{
  "$schema": "../target.schema.json",
  "version": 1,
  "host": "workload-non-prod-eu-01.flanksource.com",
  "app": "gke-control-plane",
  "cluster": "workload-non-prod-eu-01",
  "source": "specs/workload-non-prod-eu-01/config-connector/resources/dnszone.yaml",
  "profiles": [
    "safe"
  ],
  "ports": [
    443,
    6443,
    10250
  ],
  "tags": [
    "control-plane",
    "dns-apex",
    "kubernetes"
  ],
  "notes": "Public DNS zone apex.",
  "class": "internal",
  "observed": {
    "last_attempt": "2026-08-09T09:45:27.785Z",
    "error": "cause=\"no address found for host\""
  }
}
