{
  "$schema": "../target.schema.json",
  "version": 1,
  "host": "mc.org-puirhxj5j7oz.workload-prod-eu-01.flanksource.com",
  "app": "mission-control-tenant",
  "cluster": "workload-prod-eu-02",
  "source": "specs/hub-prod-eu-01/specs/mission-control-agent/secret.yaml",
  "profiles": [
    "safe"
  ],
  "tags": [
    "mission-control",
    "tenant",
    "pii",
    "api",
    "ui"
  ],
  "notes": "Live customer tenant. Naming scheme is mc.org-<slug>.workload-prod-eu-01. Safe profile only.",
  "class": "prod",
  "observed": {
    "first_observed": "2026-08-08T21:16:00Z",
    "last_seen": "2026-08-09T09:45:27.785Z",
    "last_attempt": "2026-08-09T09:45:27.785Z"
  },
  "http": {
    "url": "https://mc.org-puirhxj5j7oz.workload-prod-eu-01.flanksource.com",
    "scheme": "https",
    "port": 443,
    "status_code": 401,
    "content_type": "text/plain",
    "response_time": "516.211125ms",
    "failed": false
  },
  "network": {
    "ip": "34.76.46.20",
    "ipv4": [
      "34.76.46.20"
    ],
    "resolvers": [
      "8.8.4.4:53",
      "8.8.8.8:53"
    ],
    "cdn": {
      "enabled": true,
      "name": "google",
      "type": "cdn"
    },
    "asn": {
      "number": 396982,
      "name": "google-cloud-platform",
      "country": "US"
    }
  },
  "tech": {
    "names": [
      "HSTS"
    ]
  },
  "tls": {
    "tls_version": "tls13",
    "cipher": "TLS_AES_256_GCM_SHA384",
    "subject_dn": "CN=mc.org-puirhxj5j7oz.workload-prod-eu-01.flanksource.com",
    "subject_cn": "mc.org-puirhxj5j7oz.workload-prod-eu-01.flanksource.com",
    "subject_an": [
      "mc.org-puirhxj5j7oz.workload-prod-eu-01.flanksource.com"
    ],
    "issuer_dn": "CN=YR2, O=Let's Encrypt, C=US",
    "issuer_cn": "YR2",
    "issuer_org": [
      "Let's Encrypt"
    ],
    "not_before": "2026-07-07T09:40:45Z",
    "not_after": "2026-10-05T09:40:44Z",
    "serial": "05:50:F4:06:FF:99:BE:E9:1B:F3:D9:D7:AB:33:75:8A:B0:A3",
    "fingerprint_hash": "63c1c890b18ac634716eabdef070c383cb260cb4b556cf0944b42f7bc26e9e07"
  }
}
