{
  "$schema": "../target.schema.json",
  "version": 1,
  "host": "audit-report.app.flanksource.com",
  "source": "discovered",
  "profiles": [
    "safe"
  ],
  "notes": "Discovered via subfinder/httpx.",
  "class": "non-prod",
  "tags": [],
  "observed": {
    "first_observed": "2026-08-09T07:32:50Z",
    "last_attempt": "2026-08-09T09:45:27.785Z",
    "error": "cause=\"no address found for host\""
  },
  "scan": {
    "last_scan": "2026-08-09T07:32:50Z",
    "last_findings": 0
  }
}
