{
  "$schema": "../target.schema.json",
  "version": 1,
  "host": "mc.org-g492sj1ah0kn.workload-prod-eu-02.flanksource.com",
  "source": "discovered",
  "profiles": [
    "safe"
  ],
  "notes": "Discovered via subfinder/httpx.",
  "class": "non-prod",
  "tags": [],
  "observed": {
    "first_observed": "2026-08-08T21:16:00Z",
    "last_seen": "2026-08-09T09:45:27.785Z",
    "last_attempt": "2026-08-09T09:45:27.785Z"
  },
  "http": {
    "url": "https://mc.org-g492sj1ah0kn.workload-prod-eu-02.flanksource.com",
    "scheme": "https",
    "port": 443,
    "status_code": 401,
    "content_type": "text/plain",
    "response_time": "510.89175ms",
    "failed": false
  },
  "scan": {
    "last_scan": "2026-08-09T07:32:50Z",
    "last_findings": 4
  },
  "network": {
    "ip": "34.76.46.20",
    "ipv4": [
      "34.76.46.20"
    ],
    "resolvers": [
      "1.1.1.1:53",
      "8.8.4.4:53"
    ],
    "cdn": {
      "enabled": true,
      "name": "google",
      "type": "cdn"
    },
    "asn": {
      "number": 396982,
      "name": "google-cloud-platform",
      "country": "US"
    }
  },
  "tech": {
    "names": [
      "HSTS"
    ]
  },
  "tls": {
    "tls_version": "tls13",
    "cipher": "TLS_AES_256_GCM_SHA384",
    "subject_dn": "CN=mc.org-g492sj1ah0kn.workload-prod-eu-02.flanksource.com",
    "subject_cn": "mc.org-g492sj1ah0kn.workload-prod-eu-02.flanksource.com",
    "subject_an": [
      "mc.org-g492sj1ah0kn.workload-prod-eu-02.flanksource.com"
    ],
    "issuer_dn": "CN=YR1, O=Let's Encrypt, C=US",
    "issuer_cn": "YR1",
    "issuer_org": [
      "Let's Encrypt"
    ],
    "not_before": "2026-07-25T07:50:26Z",
    "not_after": "2026-10-23T07:50:25Z",
    "serial": "06:C6:6F:E2:28:B3:E4:22:9E:19:E0:9D:F8:80:19:B6:34:AB",
    "fingerprint_hash": "f4564976a49ab9982d70ba54a22a4ebd798ac1f1dbc23a33782f0cdf65bbcc38"
  }
}
