{
  "$schema": "../target.schema.json",
  "version": 1,
  "host": "emails.flanksource.com",
  "source": "discovered",
  "profiles": [
    "safe"
  ],
  "notes": "Discovered via subfinder/httpx.",
  "class": "non-prod",
  "tags": [],
  "observed": {
    "first_observed": "2026-08-08T21:16:00Z",
    "last_seen": "2026-08-09T09:45:27.785Z",
    "last_attempt": "2026-08-09T09:45:27.785Z"
  },
  "http": {
    "url": "https://emails.flanksource.com",
    "scheme": "https",
    "port": 443,
    "status_code": 301,
    "webserver": "cloudflare",
    "content_type": "text/html",
    "location": "https://emails.flanksource.com/index.html",
    "response_time": "970.500792ms",
    "failed": false
  },
  "tech": {
    "names": [
      "Cloudflare",
      "Google Cloud",
      "Google Cloud CDN",
      "HSTS",
      "HTTP/3"
    ]
  },
  "scan": {
    "last_scan": "2026-08-09T07:32:50Z",
    "last_findings": 6
  },
  "network": {
    "ip": "104.26.0.73",
    "ipv4": [
      "104.26.0.73",
      "104.26.1.73",
      "172.67.73.121"
    ],
    "ipv6": [
      "2606:4700:20::681a:149",
      "2606:4700:20::681a:49",
      "2606:4700:20::ac43:4979"
    ],
    "resolvers": [
      "1.0.0.1:53"
    ],
    "cdn": {
      "enabled": true,
      "name": "cloudflare",
      "type": "waf"
    },
    "asn": {
      "number": 13335,
      "name": "cloudflarenet",
      "country": "US"
    }
  },
  "tls": {
    "tls_version": "tls13",
    "cipher": "TLS_AES_128_GCM_SHA256",
    "subject_dn": "CN=emails.flanksource.com",
    "subject_cn": "emails.flanksource.com",
    "subject_an": [
      "emails.flanksource.com"
    ],
    "issuer_dn": "CN=WE1, O=Google Trust Services, C=US",
    "issuer_cn": "WE1",
    "issuer_org": [
      "Google Trust Services"
    ],
    "not_before": "2026-07-15T14:14:08Z",
    "not_after": "2026-10-13T15:13:59Z",
    "serial": "AC:FE:1A:63:6E:69:92:23:0E:BE:9D:6B:BF:C9:CB:D7",
    "fingerprint_hash": "625de46abfa1968d49dc408e05de843bb516f01a4fb90de91b782844f0617a27"
  }
}
