{
  "$schema": "../target.schema.json",
  "version": 1,
  "host": "clerk.flanksource.com",
  "source": "discovered",
  "profiles": [
    "safe"
  ],
  "notes": "Discovered via subfinder/httpx.",
  "class": "non-prod",
  "tags": [],
  "observed": {
    "first_observed": "2026-08-08T21:16:00Z",
    "last_seen": "2026-08-09T09:45:27.785Z",
    "last_attempt": "2026-08-09T09:45:27.785Z"
  },
  "http": {
    "url": "https://clerk.flanksource.com",
    "scheme": "https",
    "port": 443,
    "status_code": 200,
    "webserver": "cloudflare",
    "content_type": "application/json",
    "response_time": "463.1445ms",
    "failed": false
  },
  "tech": {
    "names": [
      "Cloudflare",
      "Cloudflare Bot Management",
      "Google Cloud",
      "Google Cloud Trace",
      "HSTS"
    ]
  },
  "scan": {
    "last_scan": "2026-08-09T07:32:50Z",
    "last_findings": 6
  },
  "network": {
    "ip": "104.26.1.73",
    "ipv4": [
      "104.26.0.73",
      "104.26.1.73",
      "172.67.73.121"
    ],
    "ipv6": [
      "2606:4700:20::681a:149",
      "2606:4700:20::681a:49",
      "2606:4700:20::ac43:4979"
    ],
    "resolvers": [
      "8.8.4.4:53",
      "8.8.8.8:53"
    ],
    "cdn": {
      "enabled": true,
      "name": "cloudflare",
      "type": "waf"
    },
    "asn": {
      "number": 13335,
      "name": "cloudflarenet",
      "country": "US"
    }
  },
  "tls": {
    "tls_version": "tls13",
    "cipher": "TLS_AES_128_GCM_SHA256",
    "subject_dn": "CN=clerk.flanksource.com",
    "subject_cn": "clerk.flanksource.com",
    "subject_an": [
      "clerk.flanksource.com"
    ],
    "issuer_dn": "CN=WE1, O=Google Trust Services, C=US",
    "issuer_cn": "WE1",
    "issuer_org": [
      "Google Trust Services"
    ],
    "not_before": "2026-06-19T03:33:22Z",
    "not_after": "2026-09-17T04:33:15Z",
    "serial": "76:25:7C:56:B0:70:8F:56:0E:C6:93:EC:68:E0:FA:CD",
    "fingerprint_hash": "9daaeff513623e5bacb88bd0a3ac8622a5f86299d0e2541bee9cb90774518754"
  }
}
