{
  "$schema": "../target.schema.json",
  "version": 1,
  "host": "clicky-ui.flanksource.com",
  "source": "discovered",
  "profiles": [
    "safe"
  ],
  "notes": "Discovered — Clicky UI previews",
  "class": "non-prod",
  "tags": [],
  "observed": {
    "first_observed": "2026-08-08T21:16:00Z",
    "last_seen": "2026-08-09T09:45:27.785Z",
    "last_attempt": "2026-08-09T09:45:27.785Z"
  },
  "http": {
    "url": "https://clicky-ui.flanksource.com",
    "scheme": "https",
    "port": 443,
    "status_code": 200,
    "title": "Clicky UI previews",
    "webserver": "cloudflare",
    "content_type": "text/html",
    "response_time": "528.713042ms",
    "failed": false
  },
  "tech": {
    "names": [
      "Cloudflare",
      "Cloudflare Browser Insights",
      "Fastly",
      "GitHub Pages",
      "HSTS",
      "HTTP/3",
      "Varnish"
    ]
  },
  "scan": {
    "last_scan": "2026-08-09T07:32:50Z",
    "last_findings": 2
  },
  "network": {
    "ip": "104.26.0.73",
    "ipv4": [
      "104.26.0.73",
      "104.26.1.73",
      "172.67.73.121"
    ],
    "ipv6": [
      "2606:4700:20::681a:149",
      "2606:4700:20::681a:49",
      "2606:4700:20::ac43:4979"
    ],
    "resolvers": [
      "1.1.1.1:53",
      "8.8.4.4:53"
    ],
    "cdn": {
      "enabled": true,
      "name": "cloudflare",
      "type": "waf"
    },
    "asn": {
      "number": 13335,
      "name": "cloudflarenet",
      "country": "US"
    }
  },
  "tls": {
    "tls_version": "tls13",
    "cipher": "TLS_AES_128_GCM_SHA256",
    "subject_dn": "CN=clicky-ui.flanksource.com",
    "subject_cn": "clicky-ui.flanksource.com",
    "subject_an": [
      "clicky-ui.flanksource.com"
    ],
    "issuer_dn": "CN=WE1, O=Google Trust Services, C=US",
    "issuer_cn": "WE1",
    "issuer_org": [
      "Google Trust Services"
    ],
    "not_before": "2026-07-15T10:51:08Z",
    "not_after": "2026-10-13T11:51:06Z",
    "serial": "7C:57:29:59:47:39:1C:A6:0E:57:A8:5E:94:49:84:7F",
    "fingerprint_hash": "4be108d4d5dba55bf72eddcf6247887d3fcec4550f264f015a714cd510ded6ef"
  }
}
