{
  "$schema": "../target.schema.json",
  "version": 1,
  "host": "gavel.flanksource.com",
  "source": "discovered",
  "profiles": [
    "safe"
  ],
  "notes": "Discovered — Site not found · GitHub Pages",
  "class": "non-prod",
  "tags": [],
  "observed": {
    "first_observed": "2026-08-08T21:16:00Z",
    "last_seen": "2026-08-09T09:45:27.785Z",
    "last_attempt": "2026-08-09T09:45:27.785Z"
  },
  "http": {
    "url": "https://gavel.flanksource.com",
    "scheme": "https",
    "port": 443,
    "status_code": 404,
    "title": "Site not found · GitHub Pages",
    "webserver": "cloudflare",
    "content_type": "text/html",
    "response_time": "619.769417ms",
    "failed": false
  },
  "tech": {
    "names": [
      "Cloudflare",
      "Cloudflare Browser Insights",
      "Fastly",
      "GitHub Pages",
      "HSTS",
      "HTTP/3",
      "Varnish"
    ]
  },
  "scan": {
    "last_scan": "2026-08-09T07:32:50Z",
    "last_findings": 1
  },
  "network": {
    "ip": "104.26.0.73",
    "ipv4": [
      "104.26.0.73",
      "104.26.1.73",
      "172.67.73.121"
    ],
    "ipv6": [
      "2606:4700:20::681a:149",
      "2606:4700:20::681a:49",
      "2606:4700:20::ac43:4979"
    ],
    "resolvers": [
      "1.1.1.1:53",
      "8.8.4.4:53"
    ],
    "cdn": {
      "enabled": true,
      "name": "cloudflare",
      "type": "waf"
    },
    "asn": {
      "number": 13335,
      "name": "cloudflarenet",
      "country": "US"
    }
  },
  "tls": {
    "tls_version": "tls13",
    "cipher": "TLS_AES_128_GCM_SHA256",
    "subject_dn": "CN=gavel.flanksource.com",
    "subject_cn": "gavel.flanksource.com",
    "subject_an": [
      "gavel.flanksource.com"
    ],
    "issuer_dn": "CN=WE1, O=Google Trust Services, C=US",
    "issuer_cn": "WE1",
    "issuer_org": [
      "Google Trust Services"
    ],
    "not_before": "2026-07-15T10:51:31Z",
    "not_after": "2026-10-13T11:51:24Z",
    "serial": "6C:BD:D2:A4:AE:09:DA:59:13:4E:89:2C:75:5B:1D:79",
    "fingerprint_hash": "3fa77b4fb14ac31f31e936c05250583e5d774202dec4c4722f9ffcbee0cde49a"
  }
}
