{
  "$schema": "../target.schema.json",
  "version": 1,
  "host": "demo.flanksource.com",
  "app": "mission-control-public-demo",
  "cluster": "workload-non-prod-eu-01",
  "source": "specs/workload-non-prod-eu-01/public-demo/ingress.yaml",
  "profiles": [
    "safe",
    "full"
  ],
  "tags": [
    "mission-control",
    "argocd",
    "cloudflare",
    "ui",
    "api"
  ],
  "notes": "Public demo. Backed by ArgoCD + sock-shop + canary-checker.",
  "class": "non-prod",
  "observed": {
    "first_observed": "2026-08-08T20:23:03Z",
    "last_seen": "2026-08-09T09:45:27.785Z",
    "last_attempt": "2026-08-09T09:45:27.785Z"
  },
  "http": {
    "url": "https://demo.flanksource.com",
    "scheme": "https",
    "port": 443,
    "status_code": 200,
    "webserver": "cloudflare",
    "content_type": "text/html",
    "response_time": "409.22425ms",
    "failed": false
  },
  "tech": {
    "names": [
      "Cloudflare",
      "Cloudflare Browser Insights",
      "HSTS",
      "HTTP/3"
    ],
    "cpe": [
      {
        "cpe": "cpe:2.3:a:webp:webp_server_go:*:*:*:*:*:*:*:*",
        "product": "webp_server_go",
        "vendor": "webp"
      },
      {
        "cpe": "cpe:2.3:a:zeit:next.js:*:*:*:*:*:*:*:*",
        "product": "next.js",
        "vendor": "zeit"
      },
      {
        "cpe": "cpe:2.3:a:vercel:next.js:*:*:*:*:*:*:*:*",
        "product": "next.js",
        "vendor": "vercel"
      }
    ]
  },
  "scan": {
    "last_scan": "2026-08-09T10:55:09.846Z",
    "last_findings": 2
  },
  "network": {
    "ip": "104.26.0.73",
    "ipv4": [
      "104.26.0.73",
      "104.26.1.73",
      "172.67.73.121"
    ],
    "ipv6": [
      "2606:4700:20::681a:149",
      "2606:4700:20::681a:49",
      "2606:4700:20::ac43:4979"
    ],
    "resolvers": [
      "1.0.0.1:53",
      "8.8.8.8:53"
    ],
    "cdn": {
      "enabled": true,
      "name": "cloudflare",
      "type": "waf"
    },
    "asn": {
      "number": 13335,
      "name": "cloudflarenet",
      "country": "US"
    }
  },
  "tls": {
    "tls_version": "tls13",
    "cipher": "TLS_AES_128_GCM_SHA256",
    "subject_dn": "CN=demo.flanksource.com",
    "subject_cn": "demo.flanksource.com",
    "subject_an": [
      "demo.flanksource.com"
    ],
    "issuer_dn": "CN=WE1, O=Google Trust Services, C=US",
    "issuer_cn": "WE1",
    "issuer_org": [
      "Google Trust Services"
    ],
    "not_before": "2026-07-15T14:11:56Z",
    "not_after": "2026-10-13T15:11:52Z",
    "serial": "11:99:61:AA:9E:7E:17:C1:0E:93:F5:BA:9E:38:6E:96",
    "fingerprint_hash": "e8e4e7e8341361cc3d6aa4dc0355e53f2039fe87f5e253f9c9103f3b01d993e6"
  }
}
